{
 "schema": "coilofduty.pickup/1",
 "id": "eaafcac2-ac1a-4e25-849f-ebd7ade2ab51",
 "brand": "Tonerider",
 "model": "J1N-4",
 "position": "bridge",
 "type": "bass_single",
 "params": {
  "rdc_ohm": 8386.789559974113,
  "L_H": 3.786521485100387,
  "re_ohm": 874148.4019412812,
  "cp_F": 1.910284287285851e-10
 },
 "quality": {
  "method": "xray",
  "fit_rms_db": 0.330056630317766,
  "estimated": [
   "rdc_ohm"
  ]
 },
 "derived": {
  "f0_unloaded_hz": 5889.48727480248,
  "q_unloaded": 4.611641052097715,
  "f0_std_load_hz": 3231.7407560697916,
  "q_std_load": 1.776313244229535,
  "std_load": {
   "r_ohm": 200000.0,
   "c_F": 4.7e-10
  }
 },
 "context": {
  "tool": "RackNAM Coil of Duty 0.1.0",
  "date": "2026-10-27",
  "rs_ohm": 101900.0,
  "fs": 48000.0,
  "mode": "in_guitar",
  "strings": "muted",
  "cover": false,
  "wiring": "single",
  "magnet": "Alnico 5",
  "temp_c": 21.0,
  "lcr": {
   "rdc_ohm": 7110.0,
   "meter": "at the pickup leads"
  }
 }
}